Position,Company,Location,URL
Backend Developer (Node js + Golang + GraphQL),InfoStretch,Sunnyvale  CA,https://getwork.com/details/2bbf6321c022f08678085cdd2aabbb55
Senior Node Engineer,Vanguard,Philadelphia  PA,https://getwork.com/details/81730938c2e12aff884c4c410f7e878e
Senior Node Engineer,Vanguard,Charlotte  NC,https://getwork.com/details/66ff6e82b64b25b1b1bb5d80eeb4c7d4
Senior Node Engineer,Vanguard,Plano  TX,https://getwork.com/details/b75a295bb03c80d112a863c509cff7a7
Node Ops Engineer,Franklin Resources,San Mateo  CA,https://getwork.com/details/b09785d5c30a4658990d5076c0212ac7
Node Ops Engineer,Franklin Resources,Remote - US  CA,https://getwork.com/details/a8eb0e8bbd76f4a739c66b321cac1774
Backend Software Engineer - Node,Builder.ai,London  ENG,https://getwork.com/details/4695e865275478baf62523ae4e0121ce
Senior API Engineer (Java/Node),Fidelity Investments,Boston  MA,https://getwork.com/details/e561994e05f0596ac3d4cd3b88ab1ec8
Node Engineer  Summer Intern,Ancestry  Inc.,Lehi  UT,https://getwork.com/details/5e1b5427ecf4233e38eb3bc798fa0089
Principal  Node Solutions Architect,Macy's  Inc.,Johns Creek  GA,https://getwork.com/details/48189edd8a84f8bbd6d6bda79f222792
Full Stack Software Engineer - React/Node,Builder.ai,London  ENG,https://getwork.com/details/03d28911690ca045c7d18a4c95883798
Software Engineer - Node Back End,FourSquare,Belgrade  MT,https://getwork.com/details/67694880b0eeae3307c22b52b8eeec5b
Senior Node Software Engineer-Hybrid,LexisNexis Risk Solutions,Southampton  England,https://getwork.com/details/0667b1e67acf1ebb555cfad1b22fda91
Software Engineer (Javascript/Node) (17598),Belden,Milford  CT,https://getwork.com/details/00500aeaaa1ff7333148602252eb3dba
Sr. React/Node .JS Developer,OpTech,Jacksonville  FL,https://getwork.com/details/e97a6e55d77529687f43adf865b185e5
Lead Consultant_ React Node/ Python,Infosys LTD,London  ENG,https://getwork.com/details/3e126ea4b71b4b930b110129256c4a26
073477-Backend Engineer - Node JS / Typescript,Capgemini Holding Inc,  GA,https://getwork.com/details/3806c73b3c499a46f16f91e516ae32a0
Lead Software Engineer (Java  Node  Golang),Capital One,New York  NY,https://getwork.com/details/d85f77f8e1387ee1ceb9500a3ed86db9
Lead Software Engineer (Java  Node  Golang),Capital One,San Francisco  CA,https://getwork.com/details/7827fc70e659cdbb326c853a8f509e87
Lead Software Engineer (Java  Node  Golang),Capital One,Richmond  VA,https://getwork.com/details/6e89222ce34f96eeace3d622644bcd8f
Lead Software Engineer (Java  Node  Golang),Capital One,Boston  MA,https://getwork.com/details/310d1f3ee790a5e779318ea3976e0431
Lead Software Engineer (Java  Node  Golang),Capital One,Mclean  VA,https://getwork.com/details/6c58e9f01fea3f4ebe98403dac8e5ec0
Lead Software Engineer (Java  Node  Golang),Capital One,Plano  TX,https://getwork.com/details/eed39437a42cb0479cc13368b0b83c39
Lead Software Engineer (Java  Node  Golang),Capital One,Chicago  IL,https://getwork.com/details/501424f605b921d2ac15a9b7b9963af8
Sr. Director  Node/Warehouse Management- (Technology),Macy's  Inc.,Johns Creek  GA,https://getwork.com/details/c6ec27b5cede5f5e020970acbefcdb11
073479-Backend Developer - Node JS / Typescript,Capgemini Holding Inc,  GA,https://getwork.com/details/5cc905f34fd9ce97e06d5838f5cccb01
073178-Angular and Node JS Developer,Capgemini Holding Inc,  IL,https://getwork.com/details/e701ed7451deab7c76eca854ce9cb32f
Intern - DEG Technology Node DEV Product Engineer,Micron Technology  Inc.,Boise  ID,https://getwork.com/details/d0a36e83e1eb5fc80af7c10a1f0ff476
Enabling Areas - Full-Stack Python/Node - DEC,Deloitte,Bengaluru  IN,https://getwork.com/details/58e965d5d0dd61d4bf42ecbe72a09d57
Consulting - BO: Cloud Engineering - Consultant - Node Js,Deloitte,Bengaluru  IN,https://getwork.com/details/cc13c14504786af3bc78c104b975102d
Intern - DEG Technology Node DEV Product Engineer,Micron Technology  Inc.,Boise  ID,https://getwork.com/details/70bac275c8d04a6bb35c313f352e4fe3
Senior Full Stack Software Engineer - Angular | Node,Fidelity Investments,Westlake  TX,https://getwork.com/details/16465c6b7b7e84f8795c1e0415ff72bb
Senior Full Stack Software Engineer - Angular | Node,Fidelity Investments,Durham  NC,https://getwork.com/details/5bc0cb2c3a52e51d9a4555690a73d696
Senior Full Stack Software Engineer - Angular | Node,Fidelity Investments,Merrimack  NH,https://getwork.com/details/80c7e4f740ceff35ec2fe26f079b036c
Senior Full Stack Software Engineer - Angular | Node,Fidelity Investments,Boston  MA,https://getwork.com/details/03d06042210a9009c31c9412b988b060
Software Engineer - Full Stack  Node  TypeScript  React  AWS,Fidelity National Information Services,Walbrook  MD,https://getwork.com/details/246cf781f5591877758a7c44355da005
Enabling Areas - Full-Stack Python/Node - Information Technology,Deloitte,Bengaluru  IN,https://getwork.com/details/2a5ab6d83d784202c2fe54ceaf7e5d7c
Principal Full Stack Engineer-AWS (Node/ Python/ GraphQL),Fidelity Investments,Salt Lake City  UT,https://getwork.com/details/05d9897c22121ab446c808ea06d12482
Full Stack Software Engineer (React  Node  and AWS),The Travelers Companies,Hartford  CT,https://getwork.com/details/e05cae7c10106d242058fb36e04a05a5
072984-Software Engineer Lead - Integration Engineer (Node JS & Type Script),Capgemini Holding Inc,  GA,https://getwork.com/details/fd63bd5ced549a40862d45cf2309a649
Nike North America Distribution Centers (NADC) Node Capabilities Graduate Intern,Nike  Inc.,Memphis  TN,https://getwork.com/details/215b17a14340494af027e5de048e4260
072804-Software Engineer Lead - Integration Engineer (Node JS & Type Script),Capgemini Holding Inc,  GA,https://getwork.com/details/1cf9c76fec5f890e5b941d1a63d9bf8b
073297-Software Engineer Lead - Integration Engineer (Node JS & Type Script),Capgemini Holding Inc,  NY,https://getwork.com/details/b839abbb43e7478101b5a4a39eeef393
072798-Software Engineer Lead - Integration Engineer (Node JS & Type Script),Capgemini Holding Inc,  TX,https://getwork.com/details/befc812ad4347dacb109649accd5d1a8
Master Planner,WestRock Company,Atlanta  GA,https://getwork.com/details/931f940246c9be0e6867c78cf199163d
Software Engineer II - Purchase Journey (REMOTE),Dick's Sporting Goods Inc,Coraopolis  PA,https://getwork.com/details/a70235bdb974f2de943b3f803c50537a
AfroTech Application Engineer Openings,Vanguard,Charlotte  NC,https://getwork.com/details/e13f5ff7d2fd657e84681ec74aab7dd7
Consulting - SAMA - AI & Data - Full Stack Developer - Senior Consultant,Deloitte,Bengaluru  IN,https://getwork.com/details/f6bd5ba88ae9c2d37d1d03d524c29d70
AfroTech Application Engineer Openings,Vanguard,Malvern  PA,https://getwork.com/details/a8d8b7ab6e1a21e6e39dd0391acc9907
Physician-Urology,Trinity Health Corporation,Mishawaka  IN,https://getwork.com/details/c519d25fa790b1e0dc390d8779f17ce8
Full-Time,CloudDevs,North America Only/Latin America Only/Americas Only/UK Only/Canada Only,https://weworkremotely.com/remote-jobs/clouddevs-react-node-fullstack-developer
